{
   "$schema" : "../schema/tasks/move-circle.json",
   "etasl" : {
      "initializer" : {
         "convergence_criterion" : 1e-08,
         "duration" : 3.0,
         "full" : true,
         "sample_time" : 0.01,
         "weightfactor" : 10000.0
      },
      "inputhandlers" : [
         {
            "depth" : 1,
            "is-jointstateinputhandler" : true,
            "number_of_tries" : 200,
            "topic-name" : "joint_states"
         }
      ],
      "outputhandlers" : [
         {
            "is-tfoutputhandler" : true,
            "tf" : [
               {
                  "frame_id" : "world",
                  "variable-names" : [ "wp" ]
               }
            ]
         },
         {
            "is-jointstateoutputhandler" : true,
            "topic-name" : "velcmd"
         }
      ],
      "reporting_interval" : 3,
      "sample_time" : 0.01,
      "solver" : {
         "cputime" : 100,
         "is-qpoasessolver" : true,
         "nWSR" : 100,
         "regularization_factor" : 1e-08
      }
   },
   "etaslfile" : "/workspaces/colcon_ws/install/etasl_ros2/share/etasl_ros2/scripts/etasl/move_circle.lua",
   "string" : "move-circle",
   "task" : {
      "radius" : 0.10000000000000001,
      "velocity" : 0.10000000000000001,
      "worldmodel" : "/workspaces/colcon_ws/install/etasl_ros2/share/etasl_ros2/scripts/worldmodels/worldmodel.json"
   }
}
